{"artifacts":{"asset_manifest":{"path":"asset-manifest.json","sha256":"61d0589f0c82dca0ae17afdbede9ea932c0e88ecf3adede159fab404864428a0"},"claim_map":{"path":"claim-map.json","sha256":"15ee49bbe3a8c1a78f2f129640b82f4f59d1b6a887ec157451db80cfe679c6da"},"evidence":{"path":"repository-evidence.json","sha256":"45779141ed93be36d4c37f1105f596b885e2e020514c67db1f65316117749ed0"},"plan":{"path":"readme-plan.json","sha256":"720d83e860321e3fb09add151a63fd004296e0f82ecf17a2c26837214903cab7"},"retrieval":{"path":"retrieval-packet.json","sha256":"722ea71c16934e7c6a41c956e48b5dd4b9563444acecc58d4e2946f9c4d9a5d3"},"visual_spec":{"path":"visual-spec.json","sha256":"0c58880b9ea0f525010be8ea55402441e613c8e7323597f2e6511768984a7a32"}},"candidate":{"assets":[{"path":"assets/readme-showcase/en/desktop.svg","sha256":"03b214fb0ea4a7023e42b96442c0bc03c836c3ad6bf47575865a2b642176d791"},{"path":"assets/readme-showcase/en/mobile.svg","sha256":"a1b02bfb96438e50292bf644aca86554bcdfff4a1f7b6bcfa009ea5f2dccf1ec"}],"candidate_sha256":"7c42c23854fb74bc383e41e313726153cc2ad28fcfde6053526cce7540c08428","readmes":[{"path":"README.md","sha256":"706131fefef8d030d356ce1eb6e9ce65ab158da96f8d65a5bca50fdd92c6164b"},{"path":"README_zh.md","sha256":"aaa61e15cba8406c5f5603ed50bd8d5555b251385d402aa6c5158f2d701be59e"}]},"compiled":{"fingerprint":"29c69960dba41e07def45c02ee91ff1ae69853784d893b587af4558cf884706f","inventory":{"path":"compiled/inventory.json","sha256":"07a028b6243f822fc8995ee597945f8a4be6ea6cf1f921a8612413dd6699f14c"},"retention":"manual"},"mode":"readme","schema_version":3,"target":{"base_sha":"aaaaaaaaaaaaaaaaaaaaaaaaaaaaaaaaaaaaaaaa","repository":"owner/repo"}}
